{
  "auf": "1.0",
  "kind": "valuation",
  "subject": {
    "registry": "eip155:11155111:0x00000000000000000000000000000000000000f0",
    "unitId": 4,
    "version": 1,
    "boundaryHash": "0x73afc9b7e08e024340af3c673585d4dda9498c9900ba4d3fa287a6e62e9dc405"
  },
  "assessmentBoundary": {
    "hash": "0x73afc9b7e08e024340af3c673585d4dda9498c9900ba4d3fa287a6e62e9dc405"
  },
  "interest": {
    "id": "auf:interest:net-equity@1",
    "perspective": "holder"
  },
  "snapshot": {
    "asOf": "2026-11-01T00:00:00Z",
    "hash": "0x6bea02bebf9fc37cc4178205e2be91bfe6f7298e4a4db8d68d28f5faa181fd2e"
  },
  "method": {
    "id": "0x8da6d9f12fdcbd5651f304c51b4f5b96987f8cd55b7178844f5e0f55085bd007",
    "name": "auf:method:net-equity@1",
    "params": {
      "denomination": "USD",
      "assets": [
        {
          "element": "0xe8c8cde00958908af6b3dfdd061eb686f88e1db5cf025111c86f67110149443e",
          "quantity": "100",
          "price": "1",
          "priceSource": "stable at par",
          "priceAt": "2026-11-01T00:00:00Z"
        }
      ],
      "liabilities": [
        {
          "element": "0xae4d10a2fb26cc2c1ac00e8cec50f6095d51cb9ca35040c8439d9f98b7164c13",
          "quantity": "30",
          "price": "1",
          "priceSource": "subscription invoice",
          "priceAt": "2026-11-01T00:00:00Z"
        }
      ]
    }
  },
  "inputs": {
    "data": [
      {
        "element": "0xe8c8cde00958908af6b3dfdd061eb686f88e1db5cf025111c86f67110149443e"
      },
      {
        "element": "0xae4d10a2fb26cc2c1ac00e8cec50f6095d51cb9ca35040c8439d9f98b7164c13"
      }
    ],
    "missing": [
      {
        "item": "sub-unit treasuries",
        "reason": "zero balances at snapshot"
      },
      {
        "item": "0x3f13ce02d4a85ecacba5b5a5e6658105bf3f9208088d43b2d394a1c1ca00d656",
        "reason": "shared license counted once at the swarm level; no observable price"
      }
    ],
    "coverage": "treasury and payable; the shared skill license reached through both sub-units is counted once and left unpriced"
  },
  "result": {
    "kind": "monetary",
    "value": "70.00",
    "denomination": "USD",
    "decimals": 2
  },
  "evaluator": "eip155:11155111:0x00000000000000000000000000000000000000ef",
  "notes": "Exception vector \"Shared right\": the skill license appears in both sub-units with share 1/2 each and is counted once here."
}
