{
  "auf": "1.0",
  "kind": "valuation",
  "subject": {
    "registry": "eip155:11155111:0x00000000000000000000000000000000000000f0",
    "unitId": 7,
    "version": 1,
    "boundaryHash": "0xf34213a491b9e655c353ad0dddec49f97b8d995671dd64d228ade79a2d7bb5ba"
  },
  "assessmentBoundary": {
    "hash": "0xf34213a491b9e655c353ad0dddec49f97b8d995671dd64d228ade79a2d7bb5ba"
  },
  "interest": {
    "id": "auf:interest:whole@1",
    "perspective": "holder"
  },
  "snapshot": {
    "asOf": "2026-11-01T00:00:00Z",
    "hash": "0xfe3af22dcd077fa5d361be0da619c24d66549bf36c1a9a66bdf4b4df88e817a8"
  },
  "method": {
    "id": "0xc87ccdce9b29353f5516392f5dd0d505b373965910baa6e7e95b49431cf22d22",
    "name": "auf:method:finite-horizon-dcf@1",
    "params": {
      "denomination": "USD",
      "cashflows": [
        "65",
        "65"
      ],
      "rate": "0.1",
      "terminalValue": "0",
      "periodLength": "P30D",
      "attribution": "net cash flow of the whole Unit"
    }
  },
  "inputs": {
    "data": [
      {
        "observation": "0xfe3af22dcd077fa5d361be0da619c24d66549bf36c1a9a66bdf4b4df88e817a8"
      }
    ],
    "estimates": [
      "two periods repeating October"
    ],
    "coverage": "two periods, no terminal value, reserved compute not separately valued"
  },
  "result": {
    "kind": "monetary",
    "value": "112.81",
    "denomination": "USD",
    "decimals": 2
  },
  "horizon": {
    "from": "2026-11-01T00:00:00Z",
    "to": "2026-12-31T23:59:59Z"
  },
  "evaluator": "eip155:11155111:0x00000000000000000000000000000000000000ef"
}
