{
  "auf": "1.0",
  "kind": "valuation",
  "subject": {
    "registry": "eip155:11155111:0x00000000000000000000000000000000000000f0",
    "unitId": 5,
    "version": 1,
    "boundaryHash": "0x1b0ae56ecffa30f6db1ac3d74d99e5dc40993d9e687ccaa58f407dc879f35728"
  },
  "assessmentBoundary": {
    "hash": "0x1b0ae56ecffa30f6db1ac3d74d99e5dc40993d9e687ccaa58f407dc879f35728"
  },
  "interest": {
    "id": "auf:interest:obligation@1",
    "perspective": "holder",
    "detail": "the buyer's expected payment under the tender (refund on rejection)"
  },
  "snapshot": {
    "asOf": "2026-11-01T00:00:00Z",
    "hash": "0xb18de57df76d41416f96b5df20401986b111e4d8a68302c7ffd79c559da2c05c"
  },
  "method": {
    "id": "0x75c34f058eccff31530191dc7c5ab32bc9fe2c5e8377333cf23ca3c4d02f676f",
    "name": "auf:method:conditional-payoff@1",
    "params": {
      "denomination": "USD",
      "scenarios": [
        {
          "name": "accepted",
          "probability": "0.6",
          "payoff": "-100"
        },
        {
          "name": "rejected",
          "probability": "0.4",
          "payoff": "0"
        }
      ],
      "rate": "0.1",
      "periods": 1,
      "probabilityBasis": "declared",
      "costsIncluded": false
    }
  },
  "inputs": {
    "data": [
      {
        "element": "0xcd5cb00e788e869b9d22d63f40b2c9ede7c7af2f0ce4aff031d717f7317551b0"
      }
    ],
    "estimates": [
      "acceptance probability"
    ],
    "coverage": "payment only; the value of the deliverable to the buyer is a separate interest"
  },
  "result": {
    "kind": "scenario",
    "denomination": "USD",
    "decimals": 2,
    "scenarios": [
      {
        "name": "accepted",
        "probability": "0.6",
        "value": "-100"
      },
      {
        "name": "rejected",
        "probability": "0.4",
        "value": "0"
      }
    ],
    "value": "-54.55"
  },
  "evaluator": "eip155:11155111:0x00000000000000000000000000000000000000ef",
  "notes": "Negative results are first-class: an obligation valued from the holder's perspective."
}
