{
  "auf": "1.0",
  "kind": "valuation",
  "subject": {
    "registry": "eip155:11155111:0x00000000000000000000000000000000000000f0",
    "unitId": 5,
    "version": 1,
    "boundaryHash": "0x1b0ae56ecffa30f6db1ac3d74d99e5dc40993d9e687ccaa58f407dc879f35728"
  },
  "assessmentBoundary": {
    "hash": "0x1b0ae56ecffa30f6db1ac3d74d99e5dc40993d9e687ccaa58f407dc879f35728"
  },
  "interest": {
    "id": "auf:interest:fulfillment-claim@1",
    "perspective": "executor",
    "detail": "the worker's conditional claim to the bounty"
  },
  "snapshot": {
    "asOf": "2026-11-01T00:00:00Z",
    "hash": "0xb18de57df76d41416f96b5df20401986b111e4d8a68302c7ffd79c559da2c05c"
  },
  "method": {
    "id": "0x75c34f058eccff31530191dc7c5ab32bc9fe2c5e8377333cf23ca3c4d02f676f",
    "name": "auf:method:conditional-payoff@1",
    "params": {
      "denomination": "USD",
      "scenarios": [
        {
          "name": "accepted",
          "probability": "0.6",
          "payoff": "100"
        },
        {
          "name": "rejected",
          "probability": "0.4",
          "payoff": "0"
        }
      ],
      "rate": "0.1",
      "periods": 1,
      "probabilityBasis": "declared",
      "costsIncluded": false
    }
  },
  "inputs": {
    "data": [
      {
        "element": "0x7f20c153c6f7cfbaaaea42173b10f6ab6d53f30bc343f0485b4404100be1ddb1",
        "source": "tender terms"
      }
    ],
    "estimates": [
      "acceptance probability"
    ],
    "coverage": "payout only; the worker's costs are excluded"
  },
  "result": {
    "kind": "scenario",
    "denomination": "USD",
    "decimals": 2,
    "scenarios": [
      {
        "name": "accepted",
        "probability": "0.6",
        "value": "100"
      },
      {
        "name": "rejected",
        "probability": "0.4",
        "value": "0"
      }
    ],
    "value": "54.55"
  },
  "evaluator": "eip155:11155111:0x00000000000000000000000000000000000000ef"
}
